<?xml version="1.0" encoding="UTF-8"?>
<cricketPlayerBase xmlns:xsi="http://www.w3.org/2001/XMLSchema-instance"
    xsi:noNamespaceSchemaLocation="playerBase.xsd">
    <about>
        <title>Cricket Player Information System</title>
        <author>Rajendran Seetharaman</author>
        <description>
            <p>This is a <b>cricket player</b> info system which gives the following <i>information</i> about a cricket player
            </p>
            <ol>
                <li>The demographic information about the player like nationality, playing role, batting, and bowling styles</li>
                <li>The match statistics for the player like number of matches playes, runs scored, and wickets taken.</li>
            </ol>
            <p>My motive behind developing this system was that it could be used by avid cricket followers to look up information about their favorite player organized in a useful manner.</p>
        </description>
    </about>
    <cricketPlayers>
        <cricketPlayer id="p1">
            <title>Mahendra Singh Dhoni</title>
            <description>
                <p><u><b>India <i>Wicketkeeper batsman</i></b></u></p>
                <p><u>Career Highlights</u></p>
                <ul>
                    <li>MS Dhoni is arguably the most popular and definitely the most scrutinised cricketer from India.</li>
                    <li>Under Dhoni's captaincy, India have won the top prize in all formats.</li>
                    <li>India had the No.1 Test ranking in December 2009, the 50-over World Cup in 2011 and the <pubMentioned>World Twenty20</pubMentioned> on his captaincy debut in 2007</li>
                </ul>
                <br></br>
                <ol>
                    <li>ICC One-Day Player of the Year 2008</li>
                    <li>ICC One-Day Player of the Year 2009</li>
                    <li>ICC Spirit of Cricket Award 2011</li>
                    <li>LG People's Choice Award 2013</li>
                </ol>
                <br></br>
                <editor showEdits="true">ESPNCricInfo</editor>
            </description>
            <photos>
                <photo id="ph1" fileName="MSD.jpg" />
            </photos>
            <age>36</age>
            <gender>Male</gender>
            <nationalSide>India</nationalSide>
            <playingRole>Wicketkeeper batsman</playingRole>
            <battingStyle>Right Handed</battingStyle>
            <bowlingStyle>Right-arm medium</bowlingStyle>
            <gameStats>
                <matchesPlayed>1500</matchesPlayed>
                <inningsPlayed>2300</inningsPlayed>
                <battingAverages>
                    <runs>20000</runs>
                    <centuries>50</centuries>
                    <halfCenturies>150</halfCenturies>
                </battingAverages>
                <bowlingAverages>
                    <wickets>10</wickets>
                </bowlingAverages>
                <fieldingAverages>
                    <catches>1000</catches>
                </fieldingAverages>
            </gameStats>
            <sources>
                <sourceRefId>ESPN_IND</sourceRefId>
            </sources>
            <relatedPlayers>
                <playerRefId>p2</playerRefId>
                <playerRefId>p7</playerRefId>
            </relatedPlayers>
        </cricketPlayer>
        <cricketPlayer id="p2">
            <title>Ravichandran Ashwin</title>
            <description><p>India bowling allrounder</p></description>
            <photos>
                <photo id="ph2" fileName="RA.jpg" />
            </photos>
            <age>31</age>
            <gender>Male</gender>
            <nationalSide>India</nationalSide>
            <playingRole>Bowling allrounder</playingRole>
            <battingStyle>Right Handed</battingStyle>
            <bowlingStyle>Right-arm offbreak</bowlingStyle>
            <gameStats>
                <matchesPlayed>700</matchesPlayed>
                <inningsPlayed>1200</inningsPlayed>
                <battingAverages>
                    <runs>5000</runs>
                    <centuries>20</centuries>
                    <halfCenturies>50</halfCenturies>
                </battingAverages>
                <bowlingAverages>
                    <wickets>900</wickets>
                </bowlingAverages>
                <fieldingAverages>
                    <catches>300</catches>
                </fieldingAverages>
            </gameStats>
            <sources>
                <sourceRefId>ESPN_IND</sourceRefId>
            </sources>
            <relatedPlayers>
                <playerRefId>p3</playerRefId>
            </relatedPlayers>
        </cricketPlayer>
        <cricketPlayer id="p3">
            <title>Shikhar Dhawan</title>
            <description><p>India opening batsman</p></description>
            <photos>
                <photo id="ph3" fileName="SD.jpg" />
            </photos>
            <age>31</age>
            <gender>Male</gender>
            <nationalSide>India</nationalSide>
            <playingRole>Opening batsman</playingRole>
            <battingStyle>Left Handed</battingStyle>
            <bowlingStyle>Right-arm offbreak</bowlingStyle>
            <gameStats>
                <matchesPlayed>560</matchesPlayed>
                <inningsPlayed>900</inningsPlayed>
                <battingAverages>
                    <runs>15000</runs>
                    <centuries>200</centuries>
                    <halfCenturies>300</halfCenturies>
                </battingAverages>
                <bowlingAverages>
                    <wickets>15</wickets>
                </bowlingAverages>
                <fieldingAverages>
                    <catches>250</catches>
                </fieldingAverages>
            </gameStats>
            <sources>
                <sourceRefId>ESPN_IND</sourceRefId>
            </sources>
            <relatedPlayers>
                <playerRefId>p1</playerRefId>
            </relatedPlayers>
        </cricketPlayer>
        <cricketPlayer id="p4">
            <title>Kedar Mahadav Jadhav</title>
            <description><p>Indian batsman</p></description>
            <photos>
                <photo id="ph4" fileName="KMJ.jpg" />
            </photos>
            <age>32</age>
            <gender>Male</gender>
            <nationalSide>India</nationalSide>
            <playingRole>Batsman</playingRole>
            <battingStyle>Right Handed</battingStyle>
            <bowlingStyle>Right-arm offbreak</bowlingStyle>
            <gameStats>
                <matchesPlayed>200</matchesPlayed>
                <inningsPlayed>300</inningsPlayed>
                <battingAverages>
                    <runs>6000</runs>
                    <centuries>45</centuries>
                    <halfCenturies>60</halfCenturies>
                </battingAverages>
                <bowlingAverages>
                    <wickets>15</wickets>
                </bowlingAverages>
                <fieldingAverages>
                    <catches>200</catches>
                </fieldingAverages>
            </gameStats>
            <sources>
                <sourceRefId>ESPN_IND</sourceRefId>
            </sources>
            <relatedPlayers>
                <playerRefId>p3</playerRefId>
            </relatedPlayers>
        </cricketPlayer>
        <cricketPlayer id="p5">
            <title>Kuldeep Yadav</title>
            <description><p>Indian bowler</p></description>
            <photos>
                <photo id="ph5" fileName="KY.jpg" />
            </photos>
            <age>22</age>
            <gender>Male</gender>
            <nationalSide>India</nationalSide>
            <playingRole>Bowler</playingRole>
            <battingStyle>Left Handed</battingStyle>
            <bowlingStyle>Slow left-arm chinaman</bowlingStyle>
            <gameStats>
                <matchesPlayed>150</matchesPlayed>
                <inningsPlayed>200</inningsPlayed>
                <battingAverages>
                    <runs>4000</runs>
                    <centuries>40</centuries>
                    <halfCenturies>55</halfCenturies>
                </battingAverages>
                <bowlingAverages>
                    <wickets>45</wickets>
                </bowlingAverages>
                <fieldingAverages>
                    <catches>150</catches>
                </fieldingAverages>
            </gameStats>
            <sources>
                <sourceRefId>ESPN_IND</sourceRefId>
            </sources>
            <relatedPlayers>
                <playerRefId>p3</playerRefId>
            </relatedPlayers>
        </cricketPlayer>
        <cricketPlayer id="p6">
            <title>Jasprit Jasbirsingh Bumrah</title>
            <description><p>Indian bowler</p></description>
            <photos>
                <photo id="ph6" fileName="JJB.jpg" />
            </photos>
            <age>22</age>
            <gender>Male</gender>
            <nationalSide>India</nationalSide>
            <playingRole>Bowler</playingRole>
            <battingStyle>Right Handed</battingStyle>
            <bowlingStyle>Right-arm medium</bowlingStyle>
            <gameStats>
                <matchesPlayed>200</matchesPlayed>
                <inningsPlayed>250</inningsPlayed>
                <battingAverages>
                    <runs>5000</runs>
                    <centuries>45</centuries>
                    <halfCenturies>55</halfCenturies>
                </battingAverages>
                <bowlingAverages>
                    <wickets>60</wickets>
                </bowlingAverages>
                <fieldingAverages>
                    <catches>170</catches>
                </fieldingAverages>
            </gameStats>
            <sources>
                <sourceRefId>ESPN_IND</sourceRefId>
            </sources>
            <relatedPlayers>
                <playerRefId>p4</playerRefId>
            </relatedPlayers>
        </cricketPlayer>
        <cricketPlayer id="p7">